{
  "schema": 1,
  "unit": "root",
  "kind": "value",
  "cases": [
    {
      "case": "join.ref.00",
      "origin": "reference-test:quote_test.go::TestSimpleJoin::0",
      "call": "github.com/kballard/go-shellquote:Join",
      "input": {
        "args": [
          "test"
        ]
      },
      "tags": [
        "harvested"
      ]
    },
    {
      "case": "join.ref.01",
      "origin": "reference-test:quote_test.go::TestSimpleJoin::1",
      "call": "github.com/kballard/go-shellquote:Join",
      "input": {
        "args": [
          "hello goodbye"
        ]
      },
      "tags": [
        "harvested"
      ]
    },
    {
      "case": "join.ref.02",
      "origin": "reference-test:quote_test.go::TestSimpleJoin::2",
      "call": "github.com/kballard/go-shellquote:Join",
      "input": {
        "args": [
          "hello",
          "goodbye"
        ]
      },
      "tags": [
        "harvested"
      ]
    },
    {
      "case": "join.ref.03",
      "origin": "reference-test:quote_test.go::TestSimpleJoin::3",
      "call": "github.com/kballard/go-shellquote:Join",
      "input": {
        "args": [
          "don't you know the dewey decimal system?"
        ]
      },
      "tags": [
        "harvested"
      ]
    },
    {
      "case": "join.ref.04",
      "origin": "reference-test:quote_test.go::TestSimpleJoin::4",
      "call": "github.com/kballard/go-shellquote:Join",
      "input": {
        "args": [
          "don't",
          "you",
          "know",
          "the",
          "dewey",
          "decimal",
          "system?"
        ]
      },
      "tags": [
        "harvested"
      ]
    },
    {
      "case": "join.ref.05",
      "origin": "reference-test:quote_test.go::TestSimpleJoin::5",
      "call": "github.com/kballard/go-shellquote:Join",
      "input": {
        "args": [
          "~user",
          "u~ser",
          " ~user",
          "!~user"
        ]
      },
      "tags": [
        "harvested"
      ]
    },
    {
      "case": "join.ref.06",
      "origin": "reference-test:quote_test.go::TestSimpleJoin::6",
      "call": "github.com/kballard/go-shellquote:Join",
      "input": {
        "args": [
          "foo*",
          "M{ovies,usic}",
          "ab[cd]",
          "%3"
        ]
      },
      "tags": [
        "harvested"
      ]
    },
    {
      "case": "join.ref.07",
      "origin": "reference-test:quote_test.go::TestSimpleJoin::7",
      "call": "github.com/kballard/go-shellquote:Join",
      "input": {
        "args": [
          "one",
          "",
          "three"
        ]
      },
      "tags": [
        "harvested"
      ]
    },
    {
      "case": "join.ref.08",
      "origin": "reference-test:quote_test.go::TestSimpleJoin::8",
      "call": "github.com/kballard/go-shellquote:Join",
      "input": {
        "args": [
          "some(parentheses)"
        ]
      },
      "tags": [
        "harvested"
      ]
    },
    {
      "case": "join.ref.09",
      "origin": "reference-test:quote_test.go::TestSimpleJoin::9",
      "call": "github.com/kballard/go-shellquote:Join",
      "input": {
        "args": [
          "$some_ot~her_)spe!cial_*_characters"
        ]
      },
      "tags": [
        "harvested"
      ]
    },
    {
      "case": "join.ref.10",
      "origin": "reference-test:quote_test.go::TestSimpleJoin::10",
      "call": "github.com/kballard/go-shellquote:Join",
      "input": {
        "args": [
          "' "
        ]
      },
      "tags": [
        "harvested"
      ]
    },
    {
      "case": "split.ref.00",
      "origin": "reference-test:unquote_test.go::TestSimpleSplit::0",
      "call": "github.com/kballard/go-shellquote:Split",
      "input": {
        "args": [
          "hello"
        ]
      },
      "tags": [
        "harvested"
      ]
    },
    {
      "case": "split.ref.01",
      "origin": "reference-test:unquote_test.go::TestSimpleSplit::1",
      "call": "github.com/kballard/go-shellquote:Split",
      "input": {
        "args": [
          "hello goodbye"
        ]
      },
      "tags": [
        "harvested"
      ]
    },
    {
      "case": "split.ref.02",
      "origin": "reference-test:unquote_test.go::TestSimpleSplit::2",
      "call": "github.com/kballard/go-shellquote:Split",
      "input": {
        "args": [
          "hello   goodbye"
        ]
      },
      "tags": [
        "harvested"
      ]
    },
    {
      "case": "split.ref.03",
      "origin": "reference-test:unquote_test.go::TestSimpleSplit::3",
      "call": "github.com/kballard/go-shellquote:Split",
      "input": {
        "args": [
          "glob* test?"
        ]
      },
      "tags": [
        "harvested"
      ]
    },
    {
      "case": "split.ref.04",
      "origin": "reference-test:unquote_test.go::TestSimpleSplit::4",
      "call": "github.com/kballard/go-shellquote:Split",
      "input": {
        "args": [
          "don\\'t you know the dewey decimal system\\?"
        ]
      },
      "tags": [
        "harvested"
      ]
    },
    {
      "case": "split.ref.05",
      "origin": "reference-test:unquote_test.go::TestSimpleSplit::5",
      "call": "github.com/kballard/go-shellquote:Split",
      "input": {
        "args": [
          "'don'\\''t you know the dewey decimal system?'"
        ]
      },
      "tags": [
        "harvested"
      ]
    },
    {
      "case": "split.ref.06",
      "origin": "reference-test:unquote_test.go::TestSimpleSplit::6",
      "call": "github.com/kballard/go-shellquote:Split",
      "input": {
        "args": [
          "one '' two"
        ]
      },
      "tags": [
        "harvested"
      ]
    },
    {
      "case": "split.ref.07",
      "origin": "reference-test:unquote_test.go::TestSimpleSplit::7",
      "call": "github.com/kballard/go-shellquote:Split",
      "input": {
        "args": [
          "text with\\\na backslash-escaped newline"
        ]
      },
      "tags": [
        "harvested"
      ]
    },
    {
      "case": "split.ref.08",
      "origin": "reference-test:unquote_test.go::TestSimpleSplit::8",
      "call": "github.com/kballard/go-shellquote:Split",
      "input": {
        "args": [
          "text \"with\na\" quoted newline"
        ]
      },
      "tags": [
        "harvested"
      ]
    },
    {
      "case": "split.ref.09",
      "origin": "reference-test:unquote_test.go::TestSimpleSplit::9",
      "call": "github.com/kballard/go-shellquote:Split",
      "input": {
        "args": [
          "\"quoted\\d\\\\\\\" text with\\\na backslash-escaped newline\""
        ]
      },
      "tags": [
        "harvested"
      ]
    },
    {
      "case": "split.ref.10",
      "origin": "reference-test:unquote_test.go::TestSimpleSplit::10",
      "call": "github.com/kballard/go-shellquote:Split",
      "input": {
        "args": [
          "text with an escaped \\\n newline in the middle"
        ]
      },
      "tags": [
        "harvested"
      ]
    },
    {
      "case": "split.ref.11",
      "origin": "reference-test:unquote_test.go::TestSimpleSplit::11",
      "call": "github.com/kballard/go-shellquote:Split",
      "input": {
        "args": [
          "foo\"bar\"baz"
        ]
      },
      "tags": [
        "harvested"
      ]
    },
    {
      "case": "split.ref.err.00",
      "origin": "reference-test:unquote_test.go::TestErrorSplit::0",
      "call": "github.com/kballard/go-shellquote:Split",
      "input": {
        "args": [
          "don't worry"
        ]
      },
      "tags": [
        "harvested",
        "error"
      ]
    },
    {
      "case": "split.ref.err.01",
      "origin": "reference-test:unquote_test.go::TestErrorSplit::1",
      "call": "github.com/kballard/go-shellquote:Split",
      "input": {
        "args": [
          "'test'\\''ing"
        ]
      },
      "tags": [
        "harvested",
        "error"
      ]
    },
    {
      "case": "split.ref.err.02",
      "origin": "reference-test:unquote_test.go::TestErrorSplit::2",
      "call": "github.com/kballard/go-shellquote:Split",
      "input": {
        "args": [
          "\"foo'bar"
        ]
      },
      "tags": [
        "harvested",
        "error"
      ]
    },
    {
      "case": "split.ref.err.03",
      "origin": "reference-test:unquote_test.go::TestErrorSplit::3",
      "call": "github.com/kballard/go-shellquote:Split",
      "input": {
        "args": [
          "foo\\"
        ]
      },
      "tags": [
        "harvested",
        "error"
      ]
    },
    {
      "case": "split.ref.err.04",
      "origin": "reference-test:unquote_test.go::TestErrorSplit::4",
      "call": "github.com/kballard/go-shellquote:Split",
      "input": {
        "args": [
          "   \\"
        ]
      },
      "tags": [
        "harvested",
        "error"
      ]
    },
    {
      "case": "join.no-args",
      "origin": "hand-written",
      "call": "github.com/kballard/go-shellquote:Join",
      "input": {
        "args": []
      },
      "tags": [
        "empty"
      ]
    },
    {
      "case": "join.empty-arg",
      "origin": "hand-written",
      "call": "github.com/kballard/go-shellquote:Join",
      "input": {
        "args": [
          ""
        ]
      },
      "tags": [
        "empty"
      ]
    },
    {
      "case": "join.two-empty-args",
      "origin": "hand-written",
      "call": "github.com/kballard/go-shellquote:Join",
      "input": {
        "args": [
          "",
          ""
        ]
      },
      "tags": [
        "empty"
      ]
    },
    {
      "case": "join.empty-between",
      "origin": "hand-written",
      "call": "github.com/kballard/go-shellquote:Join",
      "input": {
        "args": [
          "a",
          "",
          "",
          "b"
        ]
      },
      "tags": [
        "empty"
      ]
    },
    {
      "case": "join.space-only",
      "origin": "hand-written",
      "call": "github.com/kballard/go-shellquote:Join",
      "input": {
        "args": [
          " "
        ]
      },
      "tags": [